{
  "project": "Powerframe Ecosystem",
  "design_personality": "Crystal Executive",
  "theme_mode": "day",
  "density_mode": "executive",
  "motion_mode": "minimal",
  "chapter_accent": "crystal-gold",
  "architectural_family": "Executive Gallery",
  "spatial_identity": "Executive Gallery",
  "application_mode": "Finance Decision Support"
}
