{
  "project": "Powerframe Ecosystem",
  "design_personality": "Aurora Command",
  "theme_mode": "night",
  "density_mode": "compact",
  "motion_mode": "standard",
  "chapter_accent": "violet-cyan",
  "architectural_family": "Command Tower",
  "spatial_identity": "Operations Deck",
  "application_mode": "Runtime Management"
}
