{
  "project": "Mucho3D",
  "design_personality": "Nebula Workspace",
  "theme_mode": "night",
  "density_mode": "standard",
  "motion_mode": "standard",
  "chapter_accent": "blueprint-cyan",
  "architectural_family": "Blueprint Studio",
  "spatial_identity": "Blueprint Studio",
  "application_mode": "3D Production"
}
