{
  "project": "TheRocketTree",
  "design_personality": "Constellation Feed",
  "theme_mode": "auto",
  "density_mode": "standard",
  "motion_mode": "dynamic",
  "chapter_accent": "constellation-indigo",
  "architectural_family": "Glass Atrium",
  "spatial_identity": "Glass Atrium",
  "application_mode": "Ecosystem Entry"
}
