{
  "project": "Powerframe Ecosystem",
  "design_personality": "Fluid Productivity",
  "theme_mode": "day",
  "density_mode": "focus",
  "motion_mode": "minimal",
  "chapter_accent": "horizon-sky",
  "architectural_family": "Horizon Workspace",
  "spatial_identity": "Horizon Workspace",
  "application_mode": "Daily Workflow"
}
